{
    "id": "https://github.com/systematic-chaos/mbda-tfm",
    "$schema": "https://json-schema.org/draft-04/schema#",
    "type": "object",
    "properties": {
        "domain": {
            "type": "string",
            "enum": [
                "regression",
                "classification",
                "clustering",
                "deep-learning",
                "binomial-classification",
                "multinomial-classification",
                "misc-functions"
            ]
        },
        "dataset": {
        	"type": "object",
        	"properties": {
        		"path": {
        			"type": "string"
        		},
        		"format": {
        			"type": "string",
        			"enum": ["libsvm"]
        		}
        	},
        	"required": ["path"]
        },
        "methods": {
            "type": "array",
            "items": {
                "type": "object",
                "properties": {
                    "algorithm": {
                        "type": "string",
                        "enum": [
                        	"linear-regression",
                        	"generalized-linear-regression",
                        	"random-forest-regression",
                        	"decision-tree-regression",
                        	"gradient-boosted-tree-regression",
                        	"linear-support-vector-machine",
                        	"binomial-logistic-regression",
                        	"naive-bayes",
                        	"random-forest-classification",
                        	"multinomial-logistic-regression",
                        	"decision-tree-classification",
                        	"gradient-boosted-tree-classification",
                        	"k-means",
                        	"gaussian-mixture-model",
                        	"multilayer-perceptron-classifier",
                        	"branin"
                        ]
                    },
                    "hyperparameters": {
                        "type": "array",
                        "items": {
                            "type": "object",
                            "properties": {
                                "param": {
                                    "type": "string"
                                },
                                "values": {
                                    "type": "array",
                                    "items": {
                                        "type": [
                                            "number",
                                            "string"
                                        ]
                                    }
                                }
                            },
                            "required": [
                                "param",
                                "values"
                            ]
                        }
                    }
                },
                "required": [
                    "algorithm"
                ]
            },
            "uniqueItems": true
        },
        "parameterSearch": {
        	"type": "string",
        	"enum": [
        		"grid",
        		"random",
        		"bayesian-optimization"
        	]
        },
        "computationalResources": {
            "type": "object",
            "properties": {
                "instances": {
                    "type": "array",
                    "items": {
                        "type": "object",
                        "properties": {
                            "ec2Instance": {
                                "type": "string",
                                "pattern":"^[A-Za-z][0-9][a-z]?.(([1-9]{1,2}x)|x)?(nano|micro|small|medium|large|metal)$"
                            },
                            "additionalHardware": {
                                "type": "array",
                                "items": {
                                    "type": "string",
                                    "enum": [
                                        "GPU"
                                    ]
                                },
                                "uniqueItems": true
                            },
                            "minInstances": {
                                "type": "integer",
                                "minimum": 1,
                                "maximum": 32
                            },
                            "maxInstances": {
                                "type": "integer",
                                "minimum": 1,
                                "maximum": 32
                            }
                        }
                    }
                },
                "minTotalInstances": {
                    "type": "integer",
                    "minimum": 1,
                    "maximum": 32
                },
                "maxTotalInstances": {
                    "type": "integer",
                    "minimum": 1,
                    "maximum": 64
                }
            }
        },
        "emailAddress": {
            "type": "string",
            "format": "email"
        }
    },
    "required": [
        "domain",
        "methods",
        "emailAddress"
    ]
}