{
	"domain": "classification",
	"methods": [
		{
			"algorithm": "naive-bayes",
			"hyperparameters": [
				{
					"param": "modelType",
					"values": ["multinomial"]
				},
				{
					"param": "smoothing",
					"values": [1.0]
				}
			]
		}
	],
	"dataset": {
		"path": "s3a://zygarde-data/mllib/sample_libsvm_data.txt",
		"format": "libsvm"
	},
	"parameterSearch": "random",
	"computationalResources": {
		"minTotalInstances": 1,
		"maxTotalInstances": 1
	},
	"emailAddress": "thanatos.dreamslayer@gmail.com"
}